{
  "$defs": {
    "condition": {
      "oneOf": [
        {
          "additionalProperties": false,
          "properties": {
            "all": {
              "items": {
                "$ref": "#/$defs/condition"
              },
              "type": "array"
            }
          },
          "required": [
            "all"
          ],
          "type": "object"
        },
        {
          "additionalProperties": false,
          "properties": {
            "any": {
              "items": {
                "$ref": "#/$defs/condition"
              },
              "type": "array"
            }
          },
          "required": [
            "any"
          ],
          "type": "object"
        },
        {
          "additionalProperties": false,
          "properties": {
            "not": {
              "$ref": "#/$defs/condition"
            }
          },
          "required": [
            "not"
          ],
          "type": "object"
        },
        {
          "additionalProperties": false,
          "properties": {
            "effectId": {
              "pattern": "^[a-z0-9][a-z0-9-]*$",
              "type": "string"
            },
            "itemId": {
              "pattern": "^[a-z0-9][a-z0-9-]*$",
              "type": "string"
            },
            "pokemonId": {
              "pattern": "^[a-z0-9][a-z0-9-]*$",
              "type": "string"
            },
            "predicate": {
              "enum": [
                "effect-active",
                "created-by-holder",
                "ability-active",
                "move-succeeds",
                "form-is",
                "holds-item",
                "grounded",
                "type-is",
                "contact",
                "chance",
                "source-is-opponent",
                "status-is"
              ]
            },
            "subject": {
              "minLength": 1,
              "type": "string"
            },
            "value": {}
          },
          "required": [
            "predicate"
          ],
          "type": "object"
        }
      ]
    }
  },
  "$id": "https://disboard.es/ChampionsDB/schemas/natures.schema.json",
  "$schema": "http://json-schema.org/draft-07/schema#",
  "items": {
    "additionalProperties": false,
    "properties": {
      "available": {
        "const": true
      },
      "decreased": {
        "anyOf": [
          {
            "enum": [
              "hp",
              "attack",
              "defense",
              "spAttack",
              "spDefense",
              "speed"
            ]
          },
          {
            "type": "null"
          }
        ]
      },
      "id": {
        "pattern": "^[a-z0-9][a-z0-9-]*$",
        "type": "string"
      },
      "identity": {
        "const": true
      },
      "increased": {
        "anyOf": [
          {
            "enum": [
              "hp",
              "attack",
              "defense",
              "spAttack",
              "spDefense",
              "speed"
            ]
          },
          {
            "type": "null"
          }
        ]
      },
      "multipliers": {
        "additionalProperties": false,
        "properties": {
          "decreased": {
            "enum": [
              1,
              0.9
            ]
          },
          "increased": {
            "enum": [
              1,
              1.1
            ]
          }
        },
        "required": [
          "increased",
          "decreased"
        ],
        "type": "object"
      },
      "name": {
        "minLength": 1,
        "type": "string"
      }
    },
    "required": [
      "id",
      "identity",
      "available"
    ],
    "type": "object"
  },
  "title": "ChampionsDB: natures",
  "type": "array"
}
